{
  "id": "ee34abe9-184c-4860-964d-65650a72f001",
  "identityId": "user:1234",
  "ruleId": "8a7f9f2c-3b6f-4c1e-9a2f-0f1d2c3b4e5f",
  "state": "deleted",
  "provenance": {
    "method": "demo",
    "via": "script"
  },
  "createdAt": "2026-05-27T10:11:00.322Z",
  "updatedAt": "2026-05-27T10:11:00.364Z"
}